{
  "version": 1,
  "name": "minimal",
  "setVersion": "0.1.0",
  "setHash": "228187cd3da32fd7ac8790ab0dacc52ca60daa393569bc1e274bede3b88b4669",
  "skills": {
    "hcjmartin/skills-repo@skill-creator": {
      "skill": "skill-creator",
      "computedHash": "781bd6d3f9b19f8c9af6b53d8d0e4876d0183841b565db34ca7092ffa412d111",
      "sourceType": "github",
      "ref": "v1.2.0"
    }
  }
}
